ENST00000361390	ATA CCC ATG GCC AAC CTC CTA CTC CTC ATT GTA CCC ATT CTA ATC GCA ATG GCA TTC CTA ATG CTT ACC GAA CGA AAA ATT CTA GGC TAT ATA CAA CTA CGC AAA GGC CCC AAC GTT GTA GGC CCC TAC GGG CTA CTA CAA CCC TTC GCT GAC GCC ATA AAA CTC TTC ACC AAA GAG CCC CTA AAA CCC GCC ACA TCT ACC ATC ACC CTC TAC ATC ACC GCC CCG ACC TTA GCT CTC ACC ATC GCT CTT CTA CTA TGA ACC CCC CTC CCC ATA CCC AAC CCC CTG GTC AAC CTC AAC CTA GGC CTC CTA TTT ATT CTA GCC ACC TCT AGC CTA GCC GTT TAC TCA ATC CTC TGA TCA GGG TGA GCA TCA AAC TCA AAC TAC GCC CTG ATC GGC GCA CTG CGA GCA GTA GCC CAA ACA ATC TCA TAT GAA GTC ACC CTA GCC ATC ATT CTA CTA TCA ACA TTA CTA ATA AGT GGC TCC TTT AAC CTC TCC ACC CTT ATC ACA ACA CAA GAA CAC CTC TGA TTA CTC CTG CCA TCA TGA CCC TTG GCC ATA ATA TGA TTT ATC TCC ACA CTA GCA GAG ACC AAC CGA ACC CCC TTC GAC CTT GCC GAA GGG GAG TCC GAA CTA GTC TCA GGC TTC AAC ATC GAA TAC GCC GCA GGC CCC TTC GCC CTA TTC TTC ATA GCC GAA TAC ACA AAC ATT ATT ATA ATA AAC ACC CTC ACC ACT ACA ATC TTC CTA GGA ACA ACA TAT GAC GCA CTC TCC CCT GAA CTC TAC ACA ACA TAT TTT GTC ACC AAG ACC CTA CTT CTA ACC TCC CTG TTC TTA TGA ATT CGA ACA GCA TAC CCC CGA TTC CGC TAC GAC CAA CTC ATA CAC CTC CTA TGA AAA AAC TTC CTA CCA CTC ACC CTA GCA TTA CTT ATA TGA TAT GTC TCC ATA CCC ATT ACA ATC TCC AGC ATT CCC CCT CAA ACC
ENST00000361453	ATT AAT CCC CTG GCC CAA CCC GTC ATC TAC TCT ACC ATC TTT GCA GGC ACA CTC ATC ACA GCG CTA AGC TCG CAC TGA TTT TTT ACC TGA GTA GGC CTA GAA ATA AAC ATG CTA GCT TTT ATT CCA GTT CTA ACC AAA AAA ATA AAC CCT CGT TCC ACA GAA GCT GCC ATC AAG TAT TTC CTC ACG CAA GCA ACC GCA TCC ATA ATC CTT CTA ATA GCT ATC CTC TTC AAC AAT ATA CTC TCC GGA CAA TGA ACC ATA ACC AAT ACT ACC AAT CAA TAC TCA TCA TTA ATA ATC ATA ATA GCT ATA GCA ATA AAA CTA GGA ATA GCC CCC TTT CAC TTC TGA GTC CCA GAG GTT ACC CAA GGC ACC CCT CTG ACA TCC GGC CTG CTT CTT CTC ACA TGA CAA AAA CTA GCC CCC ATC TCA ATC ATA TAC CAA ATC TCT CCC TCA CTA AAC GTA AGC CTT CTC CTC ACT CTC TCA ATC TTA TCC ATC ATA GCA GGC AGT TGA GGT GGA TTA AAC CAA ACC CAG CTA CGC AAA ATC TTA GCA TAC TCC TCA ATT ACC CAC ATA GGA TGA ATA ATA GCA GTT CTA CCG TAC AAC CCT AAC ATA ACC ATT CTT AAT TTA ACT ATT TAT ATT ATC CTA ACT ACT ACC GCA TTC CTA CTA CTC AAC TTA AAC TCC AGC ACC ACG ACC CTA CTA CTA TCT CGC ACC TGA AAC AAG CTA ACA TGA CTA ACA CCC TTA ATT CCA TCC ACC CTC CTC TCC CTA GGA GGC CTG CCC CCG CTA ACC GGC TTT TTG CCC AAA TGG GCC ATT ATC GAA GAA TTC ACA AAA AAC AAT AGC CTC ATC ATC CCC ACC ATC ATA GCC ACC ATC ACC CTC CTT AAC CTC TAC TTC TAC CTA CGC CTA ATC TAC TCC ACC TCA ATC ACA CTA CTC CCC ATA TCT AAC AAC GTA AAA ATA AAA TGA CAG TTT GAA CAT ACA AAA CCC ACC CCA TTC CTC CCC ACA CTC ATC GCC CTT ACC ACG CTA CTC CTA CCT ATC TCC CCT TTT ATA CTA ATA ATC TTA
ENST00000361624	ATG TTC GCC GAC CGT TGA CTA TTC TCT ACA AAC CAC AAA GAC ATT GGA ACA CTA TAC CTA TTA TTC GGC GCA TGA GCT GGA GTC CTA GGC ACA GCT CTA AGC CTC CTT ATT CGA GCC GAG CTG GGC CAG CCA GGC AAC CTT CTA GGT AAC GAC CAC ATC TAC AAC GTT ATC GTC ACA GCC CAT GCA TTT GTA ATA ATC TTC TTC ATA GTA ATA CCC ATC ATA ATC GGA GGC TTT GGC AAC TGA CTA GTT CCC CTA ATA ATC GGT GCC CCC GAT ATG GCG TTT CCC CGC ATA AAC AAC ATA AGC TTC TGA CTC TTA CCT CCC TCT CTC CTA CTC CTG CTC GCA TCT GCT ATA GTG GAG GCC GGA GCA GGA ACA GGT TGA ACA GTC TAC CCT CCC TTA GCA GGG AAC TAC TCC CAC CCT GGA GCC TCC GTA GAC CTA ACC ATC TTC TCC TTA CAC CTA GCA GGT GTC TCC TCT ATC TTA GGG GCC ATC AAT TTC ATC ACA ACA ATT ATC AAT ATA AAA CCC CCT GCC ATA ACC CAA TAC CAA ACG CCC CTC TTC GTC TGA TCC GTC CTA ATC ACA GCA GTC CTA CTT CTC CTA TCT CTC CCA GTC CTA GCT GCT GGC ATC ACT ATA CTA CTA ACA GAC CGC AAC CTC AAC ACC ACC TTC TTC GAC CCC GCC GGA GGA GGA GAC CCC ATT CTA TAC CAA CAC CTA TTC TGA TTT TTC GGT CAC CCT GAA GTT TAT ATT CTT ATC CTA CCA GGC TTC GGA ATA ATC TCC CAT ATT GTA ACT TAC TAC TCC GGA AAA AAA GAA CCA TTT GGA TAC ATA GGT ATG GTC TGA GCT ATG ATA TCA ATT GGC TTC CTA GGG TTT ATC GTG TGA GCA CAC CAT ATA TTT ACA GTA GGA ATA GAC GTA GAC ACA CGA GCA TAT TTC ACC TCC GCT ACC ATA ATC ATC GCT ATC CCC ACC GGC GTC AAA GTA TTT AGC TGA CTC GCC ACA CTC CAC GGA AGC AAT ATG AAA TGA TCT GCT GCA GTG CTC TGA GCC CTA GGA TTC ATC TTT CTT TTC ACC GTA GGT GGC CTG ACT GGC ATT GTA TTA GCA AAC TCA TCA CTA GAC ATC GTA CTA CAC GAC ACG TAC TAC GTT GTA GCC CAC TTC CAC TAT GTC CTA TCA ATA GGA GCT GTA TTT GCC ATC ATA GGA GGC TTC ATT CAC TGA TTT CCC CTA TTC TCA GGC TAC ACC CTA GAC CAA ACC TAC GCC AAA ATC CAT TTC ACT ATC ATA TTC ATC GGC GTA AAT CTA ACT TTC TTC CCA CAA CAC TTT CTC GGC CTA TCC GGA ATG CCC CGA CGT TAC TCG GAC TAC CCC GAT GCA TAC ACC ACA TGA AAC ATC CTA TCA TCT GTA GGC TCA TTC ATT TCT CTA ACA GCA GTA ATA TTA ATA ATT TTC ATG ATT TGA GAA GCC TTC GCT TCG AAG CGA AAA GTC CTA ATA GTA GAA GAA CCC TCC ATA AAC CTG GAG TGA CTA TAT GGA TGC CCC CCA CCC TAC CAC ACA TTC GAA GAA CCC GTA TAC ATA AAA TCT AGA
ENST00000361739	ATG GCA CAT GCA GCG CAA GTA GGT CTA CAA GAC GCT ACT TCC CCT ATC ATA GAA GAG CTT ATC ACC TTT CAT GAT CAC GCC CTC ATA ATC ATT TTC CTT ATC TGC TTC CTA GTC CTG TAT GCC CTT TTC CTA ACA CTC ACA ACA AAA CTA ACT AAT ACT AAC ATC TCA GAC GCT CAG GAA ATA GAA ACC GTC TGA ACT ATC CTG CCC GCC ATC ATC CTA GTC CTC ATC GCC CTC CCA TCC CTA CGC ATC CTT TAC ATA ACA GAC GAG GTC AAC GAT CCC TCC CTT ACC ATC AAA TCA ATT GGC CAC CAA TGG TAC TGA ACC TAC GAG TAC ACC GAC TAC GGC GGA CTA ATC TTC AAC TCC TAC ATA CTT CCC CCA TTA TTC CTA GAA CCA GGC GAC CTG CGA CTC CTT GAC GTT GAC AAT CGA GTA GTA CTC CCG ATT GAA GCC CCC ATT CGT ATA ATA ATT ACA TCA CAA GAC GTC TTG CAC TCA TGA GCT GTC CCC ACA TTA GGC TTA AAA ACA GAT GCA ATT CCC GGA CGT CTA AAC CAA ACC ACT TTC ACC GCT ACA CGA CCG GGG GTA TAC TAC GGT CAA TGC TCT GAA ATC TGT GGA GCA AAC CAC AGT TTC ATG CCC ATC GTC CTA GAA TTA ATT CCC CTA AAA ATC TTT GAA ATA GGG CCC GTA TTT ACC CTA TAG
ENST00000361851	ATG CCC CAA CTA AAT ACT ACC GTA TGG CCC ACC ATA ATT ACC CCC ATA CTC CTT ACA CTA TTC CTC ATC ACC CAA CTA AAA ATA TTA AAC ACA AAC TAC CAC CTA CCT CCC TCA CCA AAG CCC ATA AAA ATA AAA AAT TAT AAC AAA CCC TGA GAA CCA AAA TGA ACG AAA ATC TGT TCG CTT CAT TCA TTG CCC CCA CAA TCC TAG
ENST00000361899	ATG AAC GAA AAT CTG TTC GCT TCA TTC ATT GCC CCC ACA ATC CTA GGC CTA CCC GCC GCA GTA CTG ATC ATT CTA TTT CCC CCT CTA TTG ATC CCC ACC TCC AAA TAT CTC ATC AAC AAC CGA CTA ATC ACC ACC CAA CAA TGA CTA ATC AAA CTA ACC TCA AAA CAA ATG ATA ACC ATA CAC AAC ACT AAA GGA CGA ACC TGA TCT CTT ATA CTA GTA TCC TTA ATC ATT TTT ATT GCC ACA ACT AAC CTC CTC GGA CTC CTG CCT CAC TCA TTT ACA CCA ACC ACC CAA CTA TCT ATA AAC CTA GCC ATG GCC ATC CCC TTA TGA GCG GGC ACA GTG ATT ATA GGC TTT CGC TCT AAG ATT AAA AAT GCC CTA GCC CAC TTC TTA CCA CAA GGC ACA CCT ACA CCC CTT ATC CCC ATA CTA GTT ATT ATC GAA ACC ATC AGC CTA CTC ATT CAA CCA ATA GCC CTG GCC GTA CGC CTA ACC GCT AAC ATT ACT GCA GGC CAC CTA CTC ATG CAC CTA ATT GGA AGC GCC ACC CTA GCA ATA TCA ACC ATT AAC CTT CCC TCT ACA CTT ATC ATC TTC ACA ATT CTA ATT CTA CTG ACT ATC CTA GAA ATC GCT GTC GCC TTA ATC CAA GCC TAC GTT TTC ACA CTT CTA GTA AGC CTC TAC CTG CAC GAC AAC ACA TAA
ENST00000362079	ATG ACC CAC CAA TCA CAT GCC TAT CAT ATA GTA AAA CCC AGC CCA TGA CCC CTA ACA GGG GCC CTC TCA GCC CTC CTA ATG ACC TCC GGC CTA GCC ATG TGA TTT CAC TTC CAC TCC ATA ACG CTC CTC ATA CTA GGC CTA CTA ACC AAC ACA CTA ACC ATA TAC CAA TGA TGG CGC GAT GTA ACA CGA GAA AGC ACA TAC CAA GGC CAC CAC ACA CCA CCT GTC CAA AAA GGC CTT CGA TAC GGG ATA ATC CTA TTT ATT ACC TCA GAA GTT TTT TTC TTC GCA GGA TTT TTC TGA GCC TTT TAC CAC TCC AGC CTA GCC CCT ACC CCC CAA TTA GGA GGG CAC TGG CCC CCA ACA GGC ATC ACC CCG CTA AAT CCC CTA GAA GTC CCA CTC CTA AAC ACA TCC GTA TTA CTC GCA TCA GGA GTA TCA ATC ACC TGA GCT CAC CAT AGT CTA ATA GAA AAC AAC CGA AAC CAA ATA ATT CAA GCA CTG CTT ATT ACA ATT TTA CTG GGT CTC TAT TTT ACC CTC CTA CAA GCC TCA GAG TAC TTC GAG TCT CCC TTC ACC ATT TCC GAC GGC ATC TAC GGC TCA ACA TTT TTT GTA GCC ACA GGC TTC CAC GGA CTT CAC GTC ATT ATT GGC TCA ACT TTC CTC ACT ATC TGC TTC ATC CGC CAA CTA ATA TTT CAC TTT ACA TCC AAA CAT CAC TTT GGC TTC GAA GCC GCC GCC TGA TAC TGG CAT TTT GTA GAT GTG GTT TGA CTA TTT CTG TAT GTC TCC ATC TAT TGA TGA GGG TCT
ENST00000361227	ATA AAC TTC GCC TTA ATT TTA ATA ATC AAC ACC CTC CTA GCC TTA CTA CTA ATA ATT ATT ACA TTT TGA CTA CCA CAA CTC AAC GGC TAC ATA GAA AAA TCC ACC CCT TAC GAG TGC GGC TTC GAC CCT ATA TCC CCC GCC CGC GTC CCT TTC TCC ATA AAA TTC TTC TTA GTA GCT ATT ACC TTC TTA TTA TTT GAT CTA GAA ATT GCC CTC CTT TTA CCC CTA CCA TGA GCC CTA CAA ACA ACT AAC CTG CCA CTA ATA GTT ATG TCA TCC CTC TTA TTA ATC ATC ATC CTA GCC CTA AGT CTG GCC TAT GAG TGA CTA CAA AAA GGA TTA GAC TGA ACC GAA
ENST00000361335	ATG CCC CTC ATT TAC ATA AAT ATT ATA CTA GCA TTT ACC ATC TCA CTT CTA GGA ATA CTA GTA TAT CGC TCA CAC CTC ATA TCC TCC CTA CTA TGC CTA GAA GGA ATA ATA CTA TCG CTG TTC ATT ATA GCT ACT CTC ATA ACC CTC AAC ACC CAC TCC CTC TTA GCC AAT ATT GTG CCT ATT GCC ATA CTA GTC TTT GCC GCC TGC GAA GCA GCG GTG GGC CTA GCC CTA CTA GTC TCA ATC TCC AAC ACA TAT GGC CTA GAC TAC GTA CAT AAC CTA AAC CTA CTC CAA TGC TAA
