ENSRNOT00000047550	V Y F I N I L T L L I P I L I A M G L L T L V E R K I L G Y M Q L R K G P N N E G P Y G K L Q P F A D A M K L F M K E P M R P L T T S M S L F I I A P T L S L T L A L S L W I P L P M P H P L I N L N L G M P F I L A T S S L S V Y S I L W S G W A S N S K Y S L F G A L R A V A Q T I S Y E V T M A L Y L L S V L L M S G S F S L Q M L I T T Q E H I W L L I P A W P M A M M W Y I S T L A E T N R A P F D L T E G E S E L V S G F N V E Y A A G P F A L F F M A E Y T N I I L M N A L T S I V F L G P L Y H I N Y P E L Y S T S F M T E T L L L S T T F L W I R A S Y P R F R Y D Q L M H L L W K N F L P L T L A F C M W Y I S L P I F L A G I P P Y T
ENSRNOT00000040993	M N P I T L T I I Y L T T F K G R L I T T L S T N L P P M W V G L E M S L L A I I P L L A N K K S P R S T E A A T K Y F L T Q A T A S M I I L L V I I L N Y K Q S G M W T L Q Q Q T N N M L L N M M L I S L A M K L G L A P F H Y W L P E V T Q G I P L H I G L I L L T W Q K I A P L S I L Y Q F Y Q L L N P T I T T I L A I S S V F V G A W G G L N Q T Q T R K I M A Y S S I A H M G W M T A I L P Y N P N L T L L N L T I Y I L L T V P M F N Y I M T N S A T T I N T L S L A W N K T P M I L T M A S I I L L S L G G L P P L T G F L P K W A I I S E L L K N N C S T L S T L M A I M A L L S L F F Y T R L I Y S M S L T T F P T N N N S K M I S H H Q N P K H N F I L P T L T V L S T L T L P L S S Q L I T
ENSRNOT00000050156	M F V N R W L F S T N H K D I G T L Y L L F G A W A G M V G T A L S I L I R A E L G Q P G A L L G D D Q I Y N V I V T A H A F V M I F F M V M P M M I G G F G N W L V P L M I G A P D M A F P R M N N M S F W L L P P S F L L L L A S S M V E A G A G T G W T V Y P P L A G N L A H A G V S V D L T I F S L H L A G V S S I L G A I N F I T T I I N M K P P A M T Q Y Q T P L F V W S V L I T A V L L L L S L P V L A A G I T M L L T D R N L N T T F F D P A G G G D P I L Y Q H L F W F F G H P E V Y I L I L P G F G I I S H V V T Y Y S G K K E P F G Y M G M V W T M M S I G F L G F I V W A H H M F T V G L D V D T R A Y F T S A T M I I A I P T G V K V F S W L A T L H G G N I K W S P A M L W A L G F I F L F T V G G L T G I V L S N S S L D I V L H D T Y Y V V A H F H Y V L S M G A V F A I M A G F V H W F P L F S G Y T L N D T W A K A H F A I M F V G V N M T F F P Q H F L G L A G M P R R Y S D Y P D A Y T T W N T V S S M G S F I S L T A V L V M I F M I W E A F A S K R E V L S I S Y S S T N L E W L H G C P P P Y H T F E E P S Y V K V K
ENSRNOT00000043693	M A Y P F Q L G L Q D A T S P I M E E L T N F H D H T L M I V F L I S S L V L Y I I S L M L T T K L T H T S T M D A Q E V E T I W T I L P A V I L I L I A L P S L R I L Y M M D E I N N P V L T V K T M G H Q W Y W S Y E Y T D Y E D L C F D S Y M I P T N D L K P G E L R L L E V D N R V V L P M E L P I R M L I S S E D V L H S W A I P S L G L K T D A I P G R L N Q A T V T S N R P G L F Y G Q C S E I C G S N H S F M P I V L E M V P L K Y F E N W S A S M I
ENSRNOT00000046201	M P Q L D T S T W F I T I I S S M A T L F I L F Q L K I S S Q T F P A P P S P K T M A T E K T N N P W E S K W T K I Y L P L S L P P Q
ENSRNOT00000046108	M N E N L F A S F I T P T M M G L P I V V T I I M F P S I L F P S S E R L I S N R L H S F Q H W L I K L I I K Q M M L I H T P K G R T W A L M I V S L I M F I G S T N L L G L L P H T F T P T T Q L S M D L S M A I P L W A G A V I L G F R H K L K N S L A H F S P Q G T P I S L I P M L I I I E T I S L F I Q P M A L A V R L T A N I T A G H L L M H L I G G A T L V L M D I S P P T A T I T F I I L L L L T V L E F A V A L I Q A Y V F T L L V S L Y L H D N T
ENSRNOT00000049683	M T H Q T H A Y H M V N P S P W P L T G A L S A L L L T S G L V M W F H Y N S T I L L S L G L L T N I L T M Y Q W W R D I I R E G T Y Q G H H T P I V Q K G L R Y G M I L F I V S E V F F F A G F F W A F Y H S S L V P T H D L G G C W P P T G I T P L N P L E V P L L N T S V L L A S G V S I T W A H H S L M E G N R N H M N Q A L L I T I L L G L Y F T I L Q A S E Y F E T S F S I S D G I Y G S T F F M A T G F H G L H V I I G S T F L I V C L L R Q L K F H F T S K H H F G F E A A A W Y W H F V D V V W L F L Y V S I Y W W G S
ENSRNOT00000041241	I N L P I I I T I N I T L S F I L I S I A F W L P Q M N L Y S E K A N P Y E C G F D P T S S A R L P F S M K F F L V A I T F L L F D L E I A L L L P L P W A I Q T T N T T T M M A T A F I L V T I L S L G L A Y E W T Q K G L E W T E
ENSRNOT00000044582	M T S A F L N L T M A F T L S L L G T F M F R S H L M S T L L C L E G M M L S L F V M T S T S T L N S N S M I S M T I P I T I L V F A A C E A A V G L A L L V K I S N T Y G T D Y V Q N L N L L Q C
ENSRNOT00000042928	M L K I I F P S I M L L P L T W L S A N K K I W T N V T S Y S F L V S L L S L S L L W Q N D E N Y L N F S V M F S S D P L S T P L I I L T T W L L P L M M L A S Q N H M K K E N M M H Q K L Y I S M L I S L Q I L L I M T F S A T E L I L F Y I L F E A T L I P T L I I I T R W G N Q T E R L N A G I Y F L F Y T L I G S I P L L I A L I S I Q N S M G T L N F L I L S L T T H P L P S T W S N T I L W L A C M M A F M I K M P L Y G V H L W L P K A H V E A P I A G S M I L A A I L L K L G G Y G M M R V S I I L D P L T K S L A Y P F I I L S L W G M I M T S S I C L R Q T D L K S L I A Y S S V S H M A L V I T A I M I Q T P W S F M G A T M L M I A H G L T S S L L F C L A N T N Y E R I H S R T M I M A R G L Q M I F P L M A T W W L L A S L A N L A L P P L I N L M G E L F I V M A T F S W S N P S I I L M A T N I V I T G M Y S M Y M I I T T Q R G K L T S H M N N L Q P S H T R E L T L M A L H I I P L M L L T I N P K L I T G L T M
ENSRNOT00000048767	M N M M T I L I L M I L D L L T T P I T F S M T I L T K L M Y F R H M L I T S I K F S F L L S L L P L L L F F H H N T E Y M I T N W H W L T I N S I K L T M S F K I D Y F S I L F L S V S L F V T W S I M Q F S S W Y M H S D P H I N R F I K Y L M M F L N N M L I L T S A N N L F Q L F I G W E G V G I M S F L L I G W W Y G L A D A N T A A L Q A I L Y N R V G D I G F I L A M T W F C L N M N S W E L Q Q I F L T N T N N N L V P L T G L L I A A T G K S A Q F G L H P W L P S A M E G P T P V S A L L H S S T M V V A G I F L M I R F H P L T S N N S T I M T A M L C L G A I T T L F T A I C A L T Q N D I K K I V A F S T S S Q L G L M M V T L G I N Q P Y L A F L H I C T H A F F K A M L F M C S G S I I H I L N D E Q D I R K M G N M M K A M P F T S S C L I I G S L A L T G M P F L T G F Y S K D L I I E A I N T C N T N A W A L M I T L I A T S M T A V Y S M R I I Y F V T M T K P R Y S P L I T I N E N N P N L I N P I K R L A L G S I L A G F L I S L N I P P T N I Q I L T M P W H L K M T A L L I T I L G F A I A L E L N N L T L N L S M S K P T K L S S F S T S L G Y Y P P I M P R I I P Q K T L N S S Y K L S L N L L D L I W S E K T I P K S T S I T Q T Q L S K M M S N Q K G L I K L Y F L S F L I T I S L I F I L H T L N P E W F Q
ENSRNOT00000051268	M T N Y M F I L S L L F L T G C L G L A L K P S P I Y G G F G L I V S G C I G C L M V L G F G G S F L G L M V F L I Y L G G M L V V F G Y T T A M A T E E Y P E T W G S N W F I F S F F V L G L F M E L V V F Y L F S L N N K V E L V D F D S L G D W L M Y E I D D V G V M L E G G I G V A A I Y S C A T W M M V V A G W S L F A G I F I I I E I T R D
ENSRNOT00000042098	M T N I R K S H P L F K I I N H S F I D L P A P S N I S S W W N F G S L L G V C L M V Q I L T G L F L A M H Y T S D T M T A F S S V T H I C R D V N Y G W L I R Y L Q A N G A S M F F I C L F L H V G R G L Y Y G S Y T F L E T W N I G I I L L F A V M A T A F M G Y V L P W G Q M S F W G A T V I T N L L S A I P Y I G T T L V E W I W G G F S V D K A T L T R F F A F H F I L P F I I A A L A I V H L L F L H E T G S N N P T G L N S D A D K I P F H P Y Y T I K D L L G V F M L L L F L M T L V L F F P D L L G D P D N Y T P A N P L N T P P H I K P E W Y F L F A Y A I L R S I P N K L G G V V A L I L S I L I L A F L P F L H T S K Q R S L T F R P I T Q I L Y W I L V A N L L V L T W I G G Q P V E H P F I I I G Q L A S I S Y F S I I L I L M P I S G I V E D K M L K W N
